category,text
politics,jamieson issues warning to bigots scotland s justice minister has warned bigoted soccer fans that she wants to hit them  where it hurts most  by banning them from matches.  cathy jamieson said exclusion orders are one of a series of measures being considered in the scottish executive campaign against sectarianism. she praised celtic and rangers for their work in tackling the problem. however  the minister said stopping sectarian abuse associated with old firm matches is a key objective. ms jamieson was speaking ahead of the third round scottish cup clash between the glasgow clubs at parkhead on sunday. the sectarianism long associated with sections of the support from both clubs has become a significant target for the executive. last week ms jamieson and first minister jack mcconnell met supporters  representatives from both clubs to discuss the issue.  they plan to hold an anti-sectarian summit next month with officials from the clubs  church leaders  senior police officers and local authority chiefs among those to be invited. speaking on bbc radio scotland s sunday live programme  ms jamieson described friday s meeting as  very productive  and said putting the squeeze on the bigots would be a key aim. ms jamieson stressed that sectarianism has not been confined to football but it can act as a  trigger  for tensions and violence. clubs have taken action in the past to ban troublesome fans and supporters  groups expressed their desire to ensure that the game is no longer tainted by the problem.  ms jamieson said the executive should have a role in tackling the soccer troublemakers. she said:  we can t get away from the fact that in some instances some of the religious hatred that some people try to associate with football boils over into violence.  that is the kind of thing we want to stop and that s the kind of thing supporters  groups are very clear they don t want to be part of either  and they will work with us to try and deal with that.   ms jamieson praised the police for their action and said:  the police do want to identify whether there are particular individuals who are going over the top and inciting hatred or violence - they will crack down very effectively on them.  we have of course already indicated that we will consider the introduction of banning orders to give additional powers to where there are people who are going over the top  who have made inappropriate behaviour at football matches  to be able to stop them attending the games.  that s the kind of thing that will hit those kind of people where it hurts the most in not allowing them to attend the games   she said. praising celtic and rangers for their efforts  she said:  i don t think there is any doubt that we have seen some positive moves from the clubs.  both rangers and celtic football clubs have been involved in working with the executive to produce  for example  an educational pack for young people.
politics,campaign  cold calls  questioned labour and the conservatives are still telephoning the millions of people who have signed up to make sure they do not get marketing  cold calls .  the parties say they can stick to the rules by ensuring that their calls are not marketing - for instance by asking about people s voting intentions. the lib dems are asking the watchdog overseeing the rules to stop the calls. the information commissioner s office says surveys are allowed but people had to be told if personal data was kept. telephone call centres are expected to be used as never before by all the three major parties in the run-up to the general election.  but seven million telephone numbers are on the telephone preference service (tps) lists  which ban unsolicited sales and marketing calls. both schemes are run by the direct marketing association and backed by eu directives on privacy and electronic communications.  the rules on marketing calls apply as much to politicians as to private sector companies. but that does not mean labour and the tories are not calling people signed up to the tps. a labour party spokesman told the bbc news website the party avoided those on tps lists when telephoning people about membership or fundraising. but that did not happen for  voter identification  calls.  when we ask which party they will vote for  that is not marketing and we have very clear legal advice that it is not   he said.  so it is not covered by the telephone preference service.   he said the party always asked people if they would be happy to be contacted again and if they said no  they were not rung again. a conservative spokeswoman said the party stuck to the rules when it rang tps subscribers. she said:  we do apply tps but in line with the law. we would not do things that are not allowed in the law.  assistant information commissioner phil jones said it was classed as marketing if political parties telephoned people to encourage them to vote for them. but  classic market research   such as a poll of voter intentions  did not constitute direct marketing  he said.  if a party is calling someone who is registered on tps and records their voting intention with a view to using this information in the future  this should be clear to the voter concerned   said mr jones.  if a party rings a person who is registered on tps to ask about their voting intention and goes on to encourage that voter to support them  the party may well be in breach of the regulations.  in summary  whether a party calling tps registered voters to check their voting intentions will breach regulations will depend on the script used and whether the script is followed.  mr jones said the watchdog received  very few complaints  on the issue.  earlier  lib dem chairman matthew taylor wrote to the watchdog saying:  the advice we have received on several previous occasions is that such phone calls are illegal.  he says evidence from local lib dem parties around the country suggests there are  significant  numbers of such calls.  i hope you can therefore take swift and efficient action to ensure that this ceases   he tells the commissioner. mr taylor argues there should be new guidelines so all parties can act in the same way if the watchdog believes the rules allow parties to ring tps numbers about voting intentions and later urge those people to vote for them.
politics,england children s tsar appointed the first children s commissioner for england has been appointed.  great ormond street hospital professor of child health  al aynsley-green  was chosen by the government and will start the £100 000-a-year job immediately. he will oversee a £2.5m annual budget and have the power to look into  any matter relating to the interests and well-being of children . prof aynsley-green has also been the national clinical director for children in the department of health. he promised to make sure that children s opinions  count .   i will be drawing on my experience of working with children and young people to help ensure that those with the power to improve children s lives do live up to their responsibilities.  i want all children and young people to know that they can approach me to discuss any matter that affects them  knowing that i will value their opinion.  education secretary ruth kelly said prof aynsley-green would  strengthen the voice of children and young people . prof aynsley-green was a lecturer at oxford university  trained at guy s hospital medical school  university of london; oriel college  oxford; and in switzerland. he is described as  a proud grandfather  of four. scotland  wales and northern ireland already have children s commissioners.
business,stock market eyes japan recovery japanese shares have ended the year at their highest level since 13 july amidst hopes of an economic recovery during 2005.  the nikkei index of leading shares gained 7.6% during the year to close at 11 488.76 points. in 2005 it  will rise toward 13 000   predicted morgan stanley equity strategist naoki kamiyama. the optimism in the financial markets contrast sharply with pessimism in the japanese business community. earlier this month  the quarterly tankan survey of japanese manufacturers found that business confidence had weakened for the first time since march 2003.  slower economic growth  rising oil prices  a stronger yen and weaker exports were blamed for the fall in confidence. despite this  traders expect strength in the global economy to benefit japan  which has been close to sliding into recession in recent months. structural reform within japan and an anticipated end to the banking sector s bad debt problems should also help  they say.
sport,lewsey puzzle over disallowed try england s josh lewsey has claimed he was denied a late try in his side s six nations loss to ireland.  the wasps wing insisted he grounded the ball when he was bundled over the line and said referee jonathan kaplan had made a wrong decision.  i m positive i touched the ball down over the line   lewsey told bbc sport.  it certainly wasn t a turnover.  i was driven over and i put the ball on the ground. the whistle went and i let go of the ball.  lewsey added:  one of the irish players scooped it back after the whistle and to our surprise the referee then gave a turnover.  as far as i m concerned  that incident and mark cueto s effort from charlie hodgson s cross-field kick that led to what looked like a good try were the two key elements in the game.   cueto was also puzzled as to why his try had been disallowed by kaplan.  i don t think i could have been offside for  without a doubt  i was behind the ball   said the sale player.  the move was a planned technique  it was not off the cuff. we rehearse it time and time again.  i wouldn t say we were robbed  some decisions go with you and some go against you. today they went against us and that s tough at international level.
politics,strike threat over pension plans millions of public service workers could strike if ministers scrap their final salary pension scheme and make them work longer  warn union leaders.  the cabinet office has confirmed it is reviewing the current pension system  prompting unions representing 4.5m workers to threaten united action. they believe the plans include raising the mandatory retirement age for public service workers from 60 to 65. the government says unions will be consulted before any changes are made.  it is thought the proposed overhaul  due on thursday  could mean pensions could be based on a  career average  salary. for each year served  staff currently get one eightieth of their highest salary in the final three years. ministers will be anxious to avoid mass strike action in the lead-up to the next general election  which is widely expected next may. in a statement on sunday  the cabinet office said it was reviewing the civil service pension scheme  and hoped to announce proposals soon.  unions will of course be consulted about any proposed changes.  public sector pension schemes need to remain affordable and sustainable. people are living longer and pensions are getting more expensive.  to maintain the long-term affordability of our pension scheme  the government announced in its green paper on pensions that pension age would rise from 60 to 65.  on monday  tony blair s official spokesman declined to say whether the prime minister backed the plans. he said:  what s important is that there s a process going on  it s out for consultation at the moment  let s wait for that process to complete itself.   there is already widespread anger over the chancellor s plans to get rid of more than 100 000 civil servants. now public service unions are united against the plans and the trades union congress is discussing the issue next monday. dave prentis  general secretary of unison  said changes to pension provisions for workers in the public sector would mean they had to pay in more but would still face a raw deal.  members working in the nhs or for local government have never had high pay or city bonuses  but they could look forward to a decent pension - now all that is being taken away   he said.  what really riles me is the breathtaking hypocrisy of mps who recently voted themselves the best pension scheme in europe  but say they can t afford it for anyone else.  this is a position that unison cannot accept and will oppose. it will lead to conflict between unison and the government  if not this year then next.   mr prentis said workers did not want to go on strike and called for talks between unions and the highest level of government. mark serwotka  from the public and commercial services union said there should be a co-ordinated one day strike unless there was a government rethink. the fire brigades union said the government was planning to cut ill health retirement benefits for firefighters and other measures to chip away at pensions. pensions officer paul woolstenholmes said:  the pensions of millions of public sector workers are under threat - apart from mps and judges who have the most generous pensions arrangements in the country.
business,standard life cuts policy bonuses standard life  europe s largest mutual life insurer  has cut bonuses for with-profit policyholders.  annual bonus rates on its with-profits life policies were cut from 2.5% to 2%  while bonuses on pension policies were reduced from 3.25% to 2.5%. it is the sixth time in three years standard life has made cuts to bonus rates  despite an 8.7% rise in the value of the with-profits fund in 2004. the insurer blamed the cuts on poor share returns and low interest rates.  with-profits policies are designed to smooth out the peaks and troughs of stock market volatility. profits made in good years are kept in reserve to pay investors an annual bonus even when the stock market performs badly. slumping share prices throughout 2001 and 2002 forced most firms to trim bonus rates on their policies. standard life came in for criticism for sticking with stock market investments during 2001 and 2002. the insurer argued that shares outperformed other investments over the long term and that policyholders would feel the benefit when the stock market recovered. recently  norwich union and axa sun life both cut their with-profit bonus rates.  john gill  managing director of the insurer s life and pensions division  said that a strong stock market recovery in the past two years had only  partly compensated for losses during 2001 and 2002 . in addition  low interest rates meant that  long-term investment returns are well below historic levels   mr gill added. however  mr gill maintained that with-profits continued to perform well over the long term.  our payouts continue to stand up well against other types of long-term investments over similar periods   he said. standard life has an estimated 2.4 million with-profits policyholders. last year  the company announced that it was looking to float on the stock market in 2006.
business,pernod takeover talk lifts domecq shares in uk drinks and food firm allied domecq have risen on speculation that it could be the target of a takeover by france s pernod ricard.  reports in the wall street journal and the financial times suggested that the french spirits firm is considering a bid  but has yet to contact its target. allied domecq shares in london rose 4% by 1200 gmt  while pernod shares in paris slipped 1.2%. pernod said it was seeking acquisitions but refused to comment on specifics.  pernod s last major purchase was a third of us giant seagram in 2000  the move which propelled it into the global top three of drinks firms. the other two-thirds of seagram was bought by market leader diageo. in terms of market value  pernod - at 7.5bn euros ($9.7bn) - is about 9% smaller than allied domecq  which has a capitalisation of £5.7bn ($10.7bn; 8.2bn euros). last year pernod tried to buy glenmorangie  one of scotland s premier whisky firms  but lost out to luxury goods firm lvmh. pernod is home to brands including chivas regal scotch whisky  havana club rum and jacob s creek wine. allied domecq s big names include malibu rum  courvoisier brandy  stolichnaya vodka and ballantine s whisky - as well as snack food chains such as dunkin  donuts and baskin-robbins ice cream. the wsj said that the two were ripe for consolidation  having each dealt with problematic parts of their portfolio. pernod has reduced the debt it took on to fund the seagram purchase to just 1.8bn euros  while allied has improved the performance of its fast-food chains.
sport,rovers reject third ferguson bid blackburn have rejected a third bid from rangers for scotland captain barry ferguson  bbc sport has learnt.  it is thought blackburn want £6m for the midfielder but chief executive john williams has confirmed the club are still  in dialogue  with rangers. the 26-year-old has already handed in a transfer request at ewood park as he seeks a return to ibrox. but the clubs have been unable to reach agreement over a fee for ferguson  who moved to lancashire in 2003 for £6.5m. on thursday rangers said they would not be increasing their offer of £4m.  blackburn have said all along that they want £6m for the midfielder and williams has rejected proposals from rangers over a player-swap deal. williams said:  we are in dialogue with glasgow rangers but we have no agreement.  the negotiations will have to be concluded by midnight on monday  when the winter transfer window shuts. williams conceded any deal for ferguson was looking  unlikely  before the close of the transfer window but rangers still had a chance to seal the deal.  we have no comment to make other than we have not got an agreement with glasgow rangers   he added.  the way things are looking  i think it is unlikely we are going to.  the ball is in their court but we have not got an offer that is acceptable at this moment.  it is understood that blackburn accepted a £5m offer for ferguson from everton at the weekend. but the player is determined to return to scotland and rejected a move to goodison park. ferguson did not play in the fa cup win over colchester on saturday despite recovering from a groin injury with rovers boss mark hughes claiming it had been an  emotional and difficult time  for the player.
politics,vouchers  to cut winter deaths  pensioners are being promised energy savings by the liberal democrats  as snow and cold temperatures continue.  the party says the plans could save the average pensioner £100 every year and cut winter deaths. the government gives £200 for winter fuel to households with people over 60  or £300 where people are over 80. the tories promise to keep the payments. the lib dems would allow people to swap these winter fuel payments for discounts on home insulation. shadow local government secretary ed davey said:  the current scheme has helped some older people  but this new liberal democrat approach will go much further to end the scandal of tens of thousands of old people dying from the winter cold every year.  the vouchers are designed to let pensioners choose from a list of approved energy supplies who would compete for business by offering discounts on home insulation schemes. the plan would boost energy conservation  says the party - and insulation could save £100 every year for pensioner households  so using the money more  intelligently  than at present.
business,ukraine trims privatisation check ukraine is to review  dozens  of state asset sales as the country s new administration tackles corruption.  the figure announced by president viktor yushchenko is less than the 3 000 cases mentioned last week  but will cover many of the biggest deals. ukraine recently ousted long-serving leader leonid kuchma and has said it wants closer european union links. in a separate statement  the eu said that the us should back ukraine s entry into the world trade organisation. the comments came as viktor yushchenko prepared to head to brussels to meet with us president george w bush and other north atlantic treaty organisation (nato) leaders. he is the only non-nato member leader invited to attend the summit.  mr yushchenko recently defeated moscow-backed presidential candidate and prime minister viktor yanukovych at the polls  and has made no secret of his wish to fight corruption and make ukraine more transparent.  earlier this month  new prime minister yulia tymoshenko said as many as 3 000 firms may have their privatisations put under the spotlight. her comments raised concerns among a number of investors and mr yushchenko was seen on monday as trying to soothe their frayed nerves.  we acknowledge that business in ukraine is now shaped and 98% of privatisations were carried out according to the law   mr yushchenko said on monday.  we have trust in this business and want to defend it by law   he continued  adding that any review would focus on  dozens of companies  not hundreds or thousands . he cited last year s sale of ukrainian steel producer krivorizhstal as one that had raised concerns. it was sold in june 2004 to a consortium that included viktor pinchuk  son-in-law of former-president kuchma  and rinat akhmetov  the country s richest man  for $800m (£424m) - despite other higher offers.  vice-prime minister oleg rybachuk called on the eu to recognise the steps that ukraine was taking  fearing that should the country not be rewarded for its efforts there may be a backlash against closer relations with brussels. he said that while he understood that ukraine was not ready for eu membership  the country needed to see progress on topics such as trade and visa requirements.  we deserve an honest response   mr rybachuk told the associated press in an interview.  we understand the difficulties. we refuse to understand double standards.  ukraine may find it has a sympathetic ear in brussels  the eu has reiterated that we support (ukraine s) fast accession to the wto and if possible we would like that to happen some time during the year   said claude veron-reville  a spokesman for eu trade commissioner peter mandelson.  we have said as much to the americans. we feel that it is important for us all to pull together for ukraine to be allowed into the wto. mr yushchenko was careful not to turn his back on russia  which borders the country to the east  saying it was important to maintain  pragmatic  ties with moscow.  russia is ukraine s eternal strategic partner   mr yushchenko said.
sport,henson stakes early lions claim the six nations may be a glittering prize in itself but every player from the four home unions will also have one eye on a possible trip to new zealand with the lions this summer.  the player who staked the biggest claim for a place in the starting xv over the weekend was gavin henson. he s very confident. you just had to listen to his interview afterwards - he beamed with confidence - but although there s an element of arrogance it s good arrogance. he certainly showed some nice touches. he once showed a clean pair of heels to mathew tait when he got outside him  his defence was very good and he made some great kicks out of hand. and that s without even mentioning his majestic match-winning penalty. but i think we need to wait and see what happens because he needs to be put to the test. he needs to come up against brian o driscoll or a big french midfield. wales fly-half stephen jones was another player who impressed me. he gave good direction  he was very confident and he was a nice general for his side. he showed he can control a game. with jonny wilkinson not playing at the moment due to inury the number 10 shirt could be up for grabs and jones  or maybe even henson  could make the lions team at fly-half.  jones stuck his hand up and he certainly looks a better bet than charlie hodgson after saturday s game. some of the wales forwards surprised me because i thought they would be out-muscled in the tight five. england prop julian white is a capable player but when it comes down to selection gethin jenkins is now going to have the upper hand because he came out on top. however  i still think white and phil vickery will be in the frame. some english players did their cause no harm. i thought joe worsley had a solid game and jason robinson and josh lewsey both did nothing wrong. but it looked too soon for young mathew tait and i think it will be a while before we see him again. despite being written off beforehand several scots caught my eye against france.  tom smith has been there and done it before  but the likes of chris cusiter  jason white and ally hogg all made their mark. hogg made a couple of good runs while white had a pretty robust game - his defence is right up there. cusiter looked very lively and he could be a very good option for lions coach sir clive woodward. the star of ireland s win over italy in rome looks like a certainty to make the starting xv against new zealand. brian o driscoll is a class act. he ran some good lines against italy  made the breaks and fed his outside backs  although italy defended man on man which made it easy for him. gordon d arcy was unlucky to go off injured early on but i think you could get a henson  d arcy  o driscoll combination in the lions midfield. paul o connell just needs to add a hard edge to his game and malcolm o kelly keeps on going and seems to be putting his hand up  while shane byrne seems to be a lively character. but they will be a bit worried after the italian pack drove them off their own ball on sunday  although i used to play in italy and i know how difficult it can be. one player who didn t impress me was wales scrum-half dwayne peel. he choked late on in the second half when wales were trailing. they had good possession and he kicked the ball away - i wouldn t want him as my lions scrum-half after that.
