category,text
politics,wales  must learn health lessons  the new health minister for wales says there are lessons to learn from england in tackling waiting lists.  dr brian gibbons  on his first full day in the job after jane hutt was sacked  admitted  big challenges  but insisted the  essentials  were in place. but both plaid cymru and the liberal democrats said dr gibbons needed to change policy. meanwhile ms hutt defended her record  saying waiting times and lists were  only 10% of the health agenda. dr gibbons  who was a gp in blaengwynfi  in the upper afan valley  before becoming am for aberavon  said nhs staff wanted a period of consolidation after  tremendous change and reform . one of the biggest problems which had faced ms hutt during her five-and-a-half years as the assembly s first health minister was the length of waiting lists in wales.  in november the british medical association said nhs staff were  weeping with despair  as figures showed 311 000 people were waiting for treatment in wales  up by 2 400 on the previous month. in the same month lists in england were at their lowest for 17 years  with 856 600 people waiting for treatment. dr gibbons told radio wales:  there is no doubt that  in managing waiting lists  england has done a lot of very very useful work  and we do need to learn from that.   but he said the nhs in wales also needed to create a healthier population rather than respond only to ill health  and a balanced view of priorities was important.  we do need a consistent across-the-board approach  recognising the patients  experience of how they use the service is going to be  at the end of the day  the main test of how the service is working.  he said nhs staff wanted a period of consolidation after  tremendous change and reform . later  dr gibbons praised the work of ms hutt  saying he  agreed with everything she s done  to change the health service in wales. dr gibbons said he accepted there was a problem  but his job now was to build on the foundations put in place by his predecessor. he also acknowledged that until the waiting list issue was sorted out  the rest of the assembly government s health policy would be overshadowed.  opposition members and some labour mps had long called for ms hutt s removal after sustained criticism over extended hospital waiting times. first minister rhodri morgan told bbc wales he had agreed with ms hutt in 2003 that she would not be health minister in the run-up to the 2007 elections.  she s been doing the job for five years and eight months and  apart from nye bevan himself  (architect of the nhs)  i don t think anybody has ever done the job for so long.  mr morgan said he had only told ms hutt of the reshuffle on monday morning  and said the nhs in wales was dr gibbons   baby  now. in response to dr gibbons  comments  ieuan wyn jones  leader of the plaid cymru group in the assembly  said:  it is apparent that this reshuffle by the first minister was just changing the deckchairs on a sinking titanic.  kisrty williams  for the lib dems  added:  if the underlying policy is going to continue  then changing the minister will serve no purpose  other than to deflect flak from labour s mps   she said. meanwhile ms hutt said she hoped  that the people of wales would benefit from my investment of the past five years and eight months  asked about waiting lists  she said that waiting times and lists were  only 10% of the health agenda  and that the welsh assembly government had  turned the corner  on the issue.
business,singapore growth at 8.1% in 2004 singapore s economy grew by 8.1% in 2004  its best performance since 2000  figures from the trade ministry show.  the advance  the second-fastest in asia after china  was led by growth of 13.1% in the key manufacturing sector. however  a slower-than-expected fourth quarter points to more modest growth for the trade-driven economy in 2005 as global technology demand falls back. slowdowns in the us and china could hit electronics exports  while the tsunami disaster may effect the service sector.  economic growth is set to halve in singapore this year to between 3% and 5%. in the fourth quarter  the city state s gross domestic product (gdp) rose at an annual rate of 2.4%. that was up from the third quarter  when it fell 3.0%  but was well below analyst forecasts.  i am surprised at the weak fourth quarter number. the main drag came from electronics   said lian chia liang  economist at jp morgan chase. singapore s economy had contracted over the summer  weighed down by soaring oil prices. the economy s poor performance in the july to september period followed four consecutive quarters of double-digit growth as singapore bounced back strongly from the effects of the deadly sars virus in 2003.
politics,parties build up poll war chests the labour party received more than £5m in donations in the final quarter of 2004  new figures show.  this is nearly half of the £11 724 929 received by 16 political parties listed by the electoral commission. the conservatives were in second place with donations totalling £4 610 849  while the liberal democrats received just over £1m. the majority of labour s donations came from affiliated trade unions. there were also large sums from individuals. lord drayson  whose company powderject won multi-million pound contracts to provide smallpox vaccine to the government after the 11 september terror attacks  gave £500 000 to the party just days before christmas.  this followed an earlier donation of the same amount earlier in 2004. he was made a lord by tony blair last year. other significant donations came from retired millionaire businessman and philanthropist sir christopher ondaatje who gave the party a sum of £500 000  and refrigerator magnate william haughey obe who gave £330 000. the totals for the fourth quarter were well up on the same period of 2003  as the parties built up their war chests for the general election campaign. the largest donation to the conservatives was a bequest from ruth beardmore of nearly £400 000. the joint founder of merchant bank hambro magan gave £325 417. there were also donations topping £250 000 for the conservatives from scottish business groups focus on scotland and the institute of international research  the world s largest independent conference company.  also among the gifts to the tories were 24 donations totalling £161 840 from bearwood corporate services. this company is controlled by the party s former treasurer lord ashcroft which has directed almost £300 000 to specific marginal constituencies over the past two years. the liberal democrats  largest donor was the joseph rowntree reform trust ltd  a company which promotes political reform and constitutional change  which gave a sum of £250 000. and fast food giants mcdonald s are listed as donating a sum of £10 575. this was a fee the firm paid for a room for an event held with the work and skills foundation during the party s conference. the uk independence party  which lost its main donor paul sykes amid the row over robert kilroy-silk s bid for the leadership last autumn  took in £63 081. just £8 170 of this was cash and the remainder came in gifts in kind  such as office space and printing. registered political parties are required to set out each quarter all donations over £5 000 to their headquarters and over £1 000 to local constituency parties they receive. it is an offence for a person to knowingly or recklessly make a false declaration about party donations.
sport,funding cut hits wales students the wales students rugby side has become a casualty of the welsh rugby union s reorganisation at youth level.  an amalgamated under-18 side formed from separate schools and national youth teams plays its first match on thursday  against italy at the gnoll. but that move has seen the wru decide to end its funding of representative sides such as wales students. as a result  traditional international fixtures against england and france in the new year have been cancelled. the welsh students rugby football union feels that it is unable to properly prepare for or stage the matches. the secretary of the welsh students rugby football union  reverend eldon phillips  said:  it is a shame that fixtures cannot be maintained this year.  the competition provided by the strong english and french teams has enabled the welsh students to test themselves in high quality matches.  the increasing number of young rugby players entering higher education look for the biggest challenge  that is representative rugby  but this year that opportunity will be denied them. players who have played for wales students before going on to win full senior representative honours include robert jones  rob howley  jon humphreys  darren morris  martyn williams and ceri sweeney.
business,call to save manufacturing jobs the trades union congress (tuc) is calling on the government to stem job losses in manufacturing firms by reviewing the help it gives companies.  the tuc said in its submission before the budget that action is needed because of 105 000 jobs lost from the sector over the last year. it calls for better pensions  child care provision and decent wages. the 36-page submission also urges the government to examine support other european countries provide to industry. tuc general secretary brendan barber called for  a commitment to policies that will make a real difference to the lives of working people.    greater investment in childcare strategies and the people delivering that childcare will increases the options available to working parents   he said.  a commitment to our public services and manufacturing sector ensures that we can continue to compete on a global level and deliver the frontline services that this country needs.  he also called for  practical measures  to help pensioners  especially women who he said  are most likely to retire in poverty . the submission also calls for decent wages and training for people working in the manufacturing sector.
tech,tech helps disabled speed demons an organisation has been launched to encourage disabled people to get involved in all aspects of motorsport  which is now increasingly possible thanks to technological innovations.  the motorsport endeavour club left the starting grid yesterday at the autosport international 2005 show at birmingham s nec  with several technologies to adapt vehicles on display.  motorcycle racer  roy tansley  from derby developed his electronic sequential gear changer following an accident which resulted in part of his left leg being amputated.  i needed to find a way of changing gear and generally you do that with your left leg   mr tansley told the bbc news website.  in simple terms  i needed to invent a left foot - initially it was quite a heath robinson device.  mr tansley had to argue his case to be allowed to continue competing with motorcycle racing s governing body  the autocycle union.  at that time they wouldn t let any amputee race at all  but eventually they told me i could have a licence as long as i raced sidecars.  mr tansley s invention  the pro-shift  is designed to work with hewland gearboxes which are widely used in motorcycle racing. in addition to helping disabled riders to compete  mr tansley reckons that the pro-shift saves at least 20 seconds per lap when he competes in the isle of man tt. as a result  there has been considerable interest in the product from other riders keen to improve their performance.  i m not prejudiced  i ll sell to able-bodied people if i have to!  he joked.  another exhibit on the motorsport endeavour stand is a subaru impreza rally car  adapted to accommodate a variety of disabilities. the vehicle belongs to pararallying  the world s only rally school for disabled drivers which is based in lincolnshire.   we use the latest technology supplied by an italian company   said rally driver dave hawkins who runs the company.  the cars have electronic throttles  electronic brakes  electronic clutches - we ve yet to turn anybody away.  mr hawkins - a paraplegic himself - says his customers have included right or left arm amputees  quadriplegics  people who have had strokes and a woman who had had all four limbs amputated. pararallying uses a vauxhall astra gsi with an automatic gearbox and manual subaru imprezas. the car on display is fitted with a  duck clutch  - a switch on the gear stick used instead of the clutch pedal. it also has a second ring behind the steering wheel to operate the throttle and a hand operated brake bar.  when joy rainey started competing in motorsport in 1974 she was continuing the family tradition - her father  murray  is a former australian formula 3 champion.  and it was rainey senior who modified a sports racer to accommodate his daughter s small stature so that she could take part in hill climbs. she uses an ordinary road car by putting extensions on the pedals  a cushion behind her back and raising the seat.  but in a competition car you have to have everything right or you ll lose the balance of the car   she said.  i bring everything back to me - steering wheel  steering column  gear lever and pedals.  when she recently took part in the london to sydney marathon she shared the driving with her partner  trevor  who now does the engineering work. he designed a system for their morris minor so that the adaptations could be totally removed in under a minute. the motorsport endeavour club is hoping that putting such technologies on display will result in more disabled people becoming involved in all areas of the sport and at every level.
business,yukos sues four firms for $20bn russian oil firm yukos has sued four companies for their role in last year s forced state auction of its key oil production unit yuganskneftegas.  yukos is claiming more than $20bn (£11bn) in damages after yugansk was sold in december to settle back taxes. the four companies named in the law suit are gas giant gazprom  its unit gazpromneft  investment company baikal  and state oil firm rosneft. yukos submitted the suit in houston  where it filed for bankruptcy. as well as suing for damages  yukos has asked the us court to send its tax dispute with the russian government to an international arbitrator. it also has submitted a reorganisation plan as part of its chapter 11 bankruptcy filing.  the clash between yukos and the kremlin came to a head last year when yukos was hit with a bill of more than $27bn in back taxes and unpaid fines. to settle the bill  russia forced yukos to sell off yuganskneftegas.  yukos called the sale illegal and has turned to courts in the us in an effort to regain control of the oil production business. it also has vowed to use all legal means at its disposal to go after any firm that tries to buy or take control of its assets. earlier this month it sued the russian government for $28.3bn. analysts have questioned whether a us court has any jurisdiction over russian companies  while moscow officials have dismissed yukos  legal wrangling as meaningless. in houston  bankruptcy judge letitia clark will start a two-day hearing on 16 february to hear arguments on whether a us court is the proper forum for the case.  the threat of legal action from yukos and its bankruptcy filing in houston did have an effect on last year s auction  however. concerned that it would be caught up in a court battle  gazprom and gazpromneft withdrew from the auction  and yuganskneftegas was sold to little-known investment firm baikal finance group. a few days later  baikal gave control of the company to state-run oil group rosneft for $9.3bn. rosneft  meanwhile  has agreed to merge with gazprom  bringing a large chunk of russia s very profitable oil business back under state control. yukos claims that the rights of its shareholders have been ignored and that is has been punished for the political ambitions of its founder mikhail khodorkovsky. mr khodorkovsky  once russia s richest man  is in prison  having been charged with fraud and tax evasion and repeatedly denied bail.
sport,hodgson relishes european clashes former blackburn boss roy hodgson says the premiership should follow the rest of europe and have a winter break - but insists that a gruelling domestic schedule will not damage the english elite s bid for champions league glory.  hodgson - now in charge at viking stavanger - was at liverpool s clash with bayer leverkusen at anfield on tuesday as a member of uefa s technical committee. hodgson is a fierce advocate of the winter break employed throughout europe  although not in england - where the champions league contenders have ploughed through a heavy fixture list. but hodgson told bbc sport that while he believes the premiership should embrace the idea  he does not expect it to cost the english representatives in the last 16 of the champions league.  i just feel it is very difficult to say with certainty that teams who have had the break will have a definite edge.  i am a fervent supporter of the break. it gives players the chance to recharge their batteries midway through the season  which some suggest will give teams an advantage in the champions league.  the other school of thought suggests having a break then coming back to it puts you at a disadvantage.  the bigger discussions around the winter break should be to do with the nature of football today  the needs of football players and the way the premiership has developed  rather than one or two matches in the champions league in february.  hodgson believes a winter break carries many advantages  explaining:  as i said  it is the perfect chance to recharge batteries.   and certainly if i was still a manager in england i would be supporting any calls for its introduction.  in pre-season you get a lot of enthusiasm and energy but by the time you get towards christmas many players  having also played plenty of international matches for club and country and travelled a lot  find themselves getting very jaded.  the break gives them a chance to recover that energy and enthusiasm and  perhaps more importantly  recover their mental strength during the break and get ready for the games ahead.  the mental side is by far the most important thing.  hodgson added:  the length of breaks can vary. in italy the break was very short. you just took christmas and new year.  it was so short you didn t do anything. you gave the players a week or 10 days off  then you were training for a week or 10 days and then went into a game.  if it is longer  it is important those responsible for physical fitness give the players a programme to follow to ensure the physical strength they have accumulated stays with them.  and hodgson believes a winter break would be a positive step in the premiership. he said:  if we talk about football at elite level  which the premiership is  then i would support a winter break.  if you examine the demands of the premier league and  in particular on players who play international football for their club and country  then a break would do them the world of good - physically and mentally.
sport,o driscoll out of scotland game ireland captain brian o driscoll has been ruled out of saturday s rbs six nations clash against scotland.  o driscoll was originally named in the starting line-up but has failed to recover from the hamstring injury he picked up in the win over italy. his replacement will be named after training on friday morning. fellow centre gordon d arcy is also struggling with a hamstring injury and he will undergo a fitness test on friday to see if he can play.  kevin maggs would be an obvious replacement at centre while shane horgan could also be moved from wing. ulster wing tommy bowe could also be asked to travel with the squad to scotland as a precautionary measure. the only other change to the ireland side sees wasps flanker johnny o connor replacing denis leamy. o connor will be winning his third cap after making his debut in the victory over south africa last november.  : murphy  horgan  tbc  d arcy  hickie  o gara  stringer  corrigan  byrne  hayes  o kelly  o connell  s easterby  o connor  foley.  : sheahan  horan  o callaghan  miller  g easterby  humphreys  dempsey.
business,khodorkovsky ally denies charges a close associate of former yukos boss mikhail khodorkovsky has told a court that fraud charges levelled against him are  false .  platon lebedev has been on trial alongside mr khodorkovsky since june in a case centring around the privatisation of a fertiliser firm. the pair claim they are being punished by the authorities for the political ambitions of mr khodorkovsky. mr lebedev said there were  absurd contradictions  in the case. opening his defence  he said he could not see the legal basis of the charges he faced  which also include allegations of tax evasion.  to my embarrassment  i could not understand the file of complaints against me   he told a moscow court. mr lebedev headed the menatep group  the parent company of yukos.  mr lebedev and mr khodorkovsky  who each face a possible 10 year jail sentence if convicted  will be questioned by a judge over the next few days. mr khodorkovsky began his testimony last week  telling the court that he objected to the way that the  running of a normal business has been presented as a work of criminal fiction . the charges are seen by supporters as politically motivated and part of a drive by russian president vladimir putin to rein in the country s super-rich business leaders  the so-called oligarchs. yukos has been presented with a $27.5bn (£13bn) tax demand by the russian authorities and its key yugansk division was auctioned off to part settle the bill. the company s effort to gain bankruptcy protection in the us - in a bid to win damages for the sale - were dismissed by a court in texas.
business,us company admits benin bribery a us defence and telecommunications company has agreed to pay $28.5m after admitting bribery in the west african state of benin.  the titan corporation was accused of funnelling more than $2m into the 2001 re-election campaign of president mathieu kerekou. at the time  titan was trying to get a higher price for a telecommunications project in benin. there is no suggestion that mr kerekou was himself aware of any wrongdoing. titan  a california-based company  pleaded guilty to falsifying its accounts and violating us anti-bribery laws. it agreed to pay $13m in criminal penalties  as well as $15.5m to settle a civil lawsuit brought by the us financial watchdog  the securities and exchange commission (sec).  the sec had accused titan of illegally paying $2.1m to an unnamed agent in benin claiming ties with president kerekou. some of the money was used to pay for t-shirts with campaign slogans on them ahead of the 2001 election. shortly after the poll  which mr kerekou won  benin officials agreed to quadruple titan s management fee. prosecuting attorney carol lam said:  all us companies should take note that attempting to bribe foreign officials is criminal conduct and will be appropriately prosecuted.  the company says it no longer tolerates such practices. under the us foreign corrupt practices act  it is a crime for american firms to bribe foreign officials.
sport,coach ranieri sacked by valencia claudio ranieri has been sacked as valencia coach just eight months after taking charge at the primera liga club for the second time in his career.  the decision was taken at a board meeting following the side s surprise elimination from the uefa cup.  we understand  and he understands  that the results in the last few weeks have not been the most appropriate   said club president juan bautista. former assistant antonio lopez will take over as the new coach. italian ranieri took over the valencia job in june 2004 having been replaced at chelsea by jose mourinho.  things began well but the spanish champions extended their winless streak to six after losing to racing santander last weekend. that defeat was then followed by a uefa cup exit at the hands of steaua bucharest. ranieri first took charge of valencia in 1997  guiding them to the king s cup and helping them to qualify for the champions league. the 54-year-old then moved to atletico madrid in 1999  before joining chelsea the following year.
